{
  "$schema": "http://json-schema.org/draft-07/schema#",
  "title": "NPOS Build Sheet",
  "type": "object",
  "required": ["id", "title", "created", "bpm", "key", "reference", "goal"],
  "properties": {
    "id": { "type": "string" },
    "title": { "type": "string" },
    "created": { "type": "string", "format": "date" },
    "status": {
      "type": "string",
      "enum": ["idea", "groove", "drop", "arrange", "mix", "master", "done"]
    },
    "bpm": { "type": "number" },
    "key": { "type": "string" },
    "reference": {
      "type": "object",
      "properties": {
        "track": { "type": "string" },
        "artist": { "type": "string" },
        "why": { "type": "string" }
      }
    },
    "bass": {
      "type": "object",
      "properties": {
        "archetype": { "type": "string" },
        "layers": {
          "type": "array",
          "items": {
            "type": "string",
            "enum": ["sub", "body", "movement", "noise"]
          }
        }
      }
    },
    "drums": {
      "type": "object",
      "properties": {
        "kick_style": { "type": "string" },
        "snare_style": { "type": "string" }
      }
    },
    "lead": {
      "type": "object",
      "properties": {
        "playing_style": { "type": "string" },
        "roles": { "type": "array", "items": { "type": "string" } }
      }
    },
    "goal": { "type": "string" },
    "problem": { "type": "string" },
    "unique_idea": { "type": "string" },
    "notes": { "type": "string" }
  }
}
